{
  "arcp_schema_version": "0.1",
  "kind": "harness",
  "id": "agent-harness",
  "version": "1.3.2",
  "name": "Agent Harness",
  "description": "Governed runtime compatibility document for the Agent Harness",
  "contracts": {
    "agent_manifest": "0.1",
    "run_request_envelope": "0.1",
    "provider_profile": "0.1",
    "run_event_contract": "0.1"
  },
  "tools": [
    "harness.llm.complete"
  ],
  "capabilities": [
    "LLM_COMPLETION",
    "MANIFEST_PATH_RUN",
    "BETA_READABLE_EVENTS",
    "PROVIDER_PROFILE_GATEWAY"
  ],
  "event_types": [
    "run.requested",
    "agent.manifest_loaded",
    "compatibility.checked",
    "policy.checked",
    "run.started",
    "llm.completion_requested",
    "llm.completion_allowed",
    "llm.completion_completed",
    "run.completed",
    "run.failed",
    "run.blocked"
  ],
  "constraints": {
    "default_network": "deny_by_default",
    "secret_policy": "secret_ref_only",
    "human_review_supported": true
  }
}
